{
  "pipeline": "AAD - ACTUS Cash Flow Projector",
  "projectionMode": "DAILY",
  "generatedAt": "2026-07-14T16:15:38.630935",
  "actusServer": "http://165.245.137.44:8083/events",
  "csvSource": "https://docs.google.com/spreadsheets/d/e/2PACX-1vT1Ve9XVb3kTQz40TcM7bR_Gj3AmDB4a9JVyiIAWnDDTsB0h96k3dUCO4pgEq0Ip2q9iriwweQpedAA/pub?gid=0&single=true&output=csv",
  "dayCountConvention": "30E360",
  "cycleOfInterest": "P1DL1",
  "contractCount": 1,
  "contracts": [
    {
      "actus_ContractID": "ACTUS_Contract/CDT-SANT-001",
      "actus_ContractType": "PAM",
      "agent": "Banco Santander",
      "inputContract": {
        "contractType": "PAM",
        "contractID": "CDT-SANT-001",
        "contractRole": "RPA",
        "currency": "COP",
        "statusDate": "2026-07-05T00:00:00",
        "notionalPrincipal": 10000000.0,
        "nominalInterestRate": 0.11,
        "dayCountConvention": "30E360",
        "maturityDate": "2026-10-05T00:00:00",
        "initialExchangeDate": "2026-07-05T00:00:00",
        "cycleAnchorDateOfInterestPayment": "2026-07-06T00:00:00",
        "cycleOfInterestPayment": "P1DL1"
      },
      "summary": {
        "totalInterest": 275000.0,
        "totalPrincipal": 10000000.0,
        "totalCashflow": 10275000.0,
        "currency": "COP",
        "totalDays": 92,
        "zeroCausationDays": 2,
        "dailyRate": 3055.5556
      },
      "events": [
        {
          "type": "IP",
          "time": "2026-07-06T00:00",
          "payoff": 3055.5556,
          "currency": "COP",
          "nominalValue": 10000000.0,
          "nominalRate": 0.11,
          "nominalAccrued": 0.0,
          "event_id": "ACTUS_Event/CDT-SANT-001-IP-20260706",
          "actus_ContractID": "ACTUS_Contract/CDT-SANT-001",
          "interestCumulative": 3055.56,
          "negotiableValue": 10003055.56,
          "dayNumber": 1,
          "isZeroDay": false
        },
        {
          "type": "IP",
          "time": "2026-07-07T00:00",
          "payoff": 3055.5556,
          "currency": "COP",
          "nominalValue": 10000000.0,
          "nominalRate": 0.11,
          "nominalAccrued": 0.0,
          "event_id": "ACTUS_Event/CDT-SANT-001-IP-20260707",
          "actus_ContractID": "ACTUS_Contract/CDT-SANT-001",
          "interestCumulative": 6111.11,
          "negotiableValue": 10006111.11,
          "dayNumber": 2,
          "isZeroDay": false
        },
        {
          "type": "IP",
          "time": "2026-07-08T00:00",
          "payoff": 3055.5556,
          "currency": "COP",
          "nominalValue": 10000000.0,
          "nominalRate": 0.11,
          "nominalAccrued": 0.0,
          "event_id": "ACTUS_Event/CDT-SANT-001-IP-20260708",
          "actus_ContractID": "ACTUS_Contract/CDT-SANT-001",
          "interestCumulative": 9166.67,
          "negotiableValue": 10009166.67,
          "dayNumber": 3,
          "isZeroDay": false
        },
        {
          "type": "IP",
          "time": "2026-07-09T00:00",
          "payoff": 3055.5556,
          "currency": "COP",
          "nominalValue": 10000000.0,
          "nominalRate": 0.11,
          "nominalAccrued": 0.0,
          "event_id": "ACTUS_Event/CDT-SANT-001-IP-20260709",
          "actus_ContractID": "ACTUS_Contract/CDT-SANT-001",
          "interestCumulative": 12222.22,
          "negotiableValue": 10012222.22,
          "dayNumber": 4,
          "isZeroDay": false
        },
        {
          "type": "IP",
          "time": "2026-07-10T00:00",
          "payoff": 3055.5556,
          "currency": "COP",
          "nominalValue": 10000000.0,
          "nominalRate": 0.11,
          "nominalAccrued": 0.0,
          "event_id": "ACTUS_Event/CDT-SANT-001-IP-20260710",
          "actus_ContractID": "ACTUS_Contract/CDT-SANT-001",
          "interestCumulative": 15277.78,
          "negotiableValue": 10015277.78,
          "dayNumber": 5,
          "isZeroDay": false
        },
        {
          "type": "IP",
          "time": "2026-07-11T00:00",
          "payoff": 3055.5556,
          "currency": "COP",
          "nominalValue": 10000000.0,
          "nominalRate": 0.11,
          "nominalAccrued": 0.0,
          "event_id": "ACTUS_Event/CDT-SANT-001-IP-20260711",
          "actus_ContractID": "ACTUS_Contract/CDT-SANT-001",
          "interestCumulative": 18333.33,
          "negotiableValue": 10018333.33,
          "dayNumber": 6,
          "isZeroDay": false
        },
        {
          "type": "IP",
          "time": "2026-07-12T00:00",
          "payoff": 3055.5556,
          "currency": "COP",
          "nominalValue": 10000000.0,
          "nominalRate": 0.11,
          "nominalAccrued": 0.0,
          "event_id": "ACTUS_Event/CDT-SANT-001-IP-20260712",
          "actus_ContractID": "ACTUS_Contract/CDT-SANT-001",
          "interestCumulative": 21388.89,
          "negotiableValue": 10021388.89,
          "dayNumber": 7,
          "isZeroDay": false
        },
        {
          "type": "IP",
          "time": "2026-07-13T00:00",
          "payoff": 3055.5556,
          "currency": "COP",
          "nominalValue": 10000000.0,
          "nominalRate": 0.11,
          "nominalAccrued": 0.0,
          "event_id": "ACTUS_Event/CDT-SANT-001-IP-20260713",
          "actus_ContractID": "ACTUS_Contract/CDT-SANT-001",
          "interestCumulative": 24444.44,
          "negotiableValue": 10024444.44,
          "dayNumber": 8,
          "isZeroDay": false
        },
        {
          "type": "IP",
          "time": "2026-07-14T00:00",
          "payoff": 3055.5556,
          "currency": "COP",
          "nominalValue": 10000000.0,
          "nominalRate": 0.11,
          "nominalAccrued": 0.0,
          "event_id": "ACTUS_Event/CDT-SANT-001-IP-20260714",
          "actus_ContractID": "ACTUS_Contract/CDT-SANT-001",
          "interestCumulative": 27500.0,
          "negotiableValue": 10027500.0,
          "dayNumber": 9,
          "isZeroDay": false
        },
        {
          "type": "IP",
          "time": "2026-07-15T00:00",
          "payoff": 3055.5556,
          "currency": "COP",
          "nominalValue": 10000000.0,
          "nominalRate": 0.11,
          "nominalAccrued": 0.0,
          "event_id": "ACTUS_Event/CDT-SANT-001-IP-20260715",
          "actus_ContractID": "ACTUS_Contract/CDT-SANT-001",
          "interestCumulative": 30555.56,
          "negotiableValue": 10030555.56,
          "dayNumber": 10,
          "isZeroDay": false
        },
        {
          "type": "IP",
          "time": "2026-07-16T00:00",
          "payoff": 3055.5556,
          "currency": "COP",
          "nominalValue": 10000000.0,
          "nominalRate": 0.11,
          "nominalAccrued": 0.0,
          "event_id": "ACTUS_Event/CDT-SANT-001-IP-20260716",
          "actus_ContractID": "ACTUS_Contract/CDT-SANT-001",
          "interestCumulative": 33611.11,
          "negotiableValue": 10033611.11,
          "dayNumber": 11,
          "isZeroDay": false
        },
        {
          "type": "IP",
          "time": "2026-07-17T00:00",
          "payoff": 3055.5556,
          "currency": "COP",
          "nominalValue": 10000000.0,
          "nominalRate": 0.11,
          "nominalAccrued": 0.0,
          "event_id": "ACTUS_Event/CDT-SANT-001-IP-20260717",
          "actus_ContractID": "ACTUS_Contract/CDT-SANT-001",
          "interestCumulative": 36666.67,
          "negotiableValue": 10036666.67,
          "dayNumber": 12,
          "isZeroDay": false
        },
        {
          "type": "IP",
          "time": "2026-07-18T00:00",
          "payoff": 3055.5556,
          "currency": "COP",
          "nominalValue": 10000000.0,
          "nominalRate": 0.11,
          "nominalAccrued": 0.0,
          "event_id": "ACTUS_Event/CDT-SANT-001-IP-20260718",
          "actus_ContractID": "ACTUS_Contract/CDT-SANT-001",
          "interestCumulative": 39722.22,
          "negotiableValue": 10039722.22,
          "dayNumber": 13,
          "isZeroDay": false
        },
        {
          "type": "IP",
          "time": "2026-07-19T00:00",
          "payoff": 3055.5556,
          "currency": "COP",
          "nominalValue": 10000000.0,
          "nominalRate": 0.11,
          "nominalAccrued": 0.0,
          "event_id": "ACTUS_Event/CDT-SANT-001-IP-20260719",
          "actus_ContractID": "ACTUS_Contract/CDT-SANT-001",
          "interestCumulative": 42777.78,
          "negotiableValue": 10042777.78,
          "dayNumber": 14,
          "isZeroDay": false
        },
        {
          "type": "IP",
          "time": "2026-07-20T00:00",
          "payoff": 3055.5556,
          "currency": "COP",
          "nominalValue": 10000000.0,
          "nominalRate": 0.11,
          "nominalAccrued": 0.0,
          "event_id": "ACTUS_Event/CDT-SANT-001-IP-20260720",
          "actus_ContractID": "ACTUS_Contract/CDT-SANT-001",
          "interestCumulative": 45833.33,
          "negotiableValue": 10045833.33,
          "dayNumber": 15,
          "isZeroDay": false
        },
        {
          "type": "IP",
          "time": "2026-07-21T00:00",
          "payoff": 3055.5556,
          "currency": "COP",
          "nominalValue": 10000000.0,
          "nominalRate": 0.11,
          "nominalAccrued": 0.0,
          "event_id": "ACTUS_Event/CDT-SANT-001-IP-20260721",
          "actus_ContractID": "ACTUS_Contract/CDT-SANT-001",
          "interestCumulative": 48888.89,
          "negotiableValue": 10048888.89,
          "dayNumber": 16,
          "isZeroDay": false
        },
        {
          "type": "IP",
          "time": "2026-07-22T00:00",
          "payoff": 3055.5556,
          "currency": "COP",
          "nominalValue": 10000000.0,
          "nominalRate": 0.11,
          "nominalAccrued": 0.0,
          "event_id": "ACTUS_Event/CDT-SANT-001-IP-20260722",
          "actus_ContractID": "ACTUS_Contract/CDT-SANT-001",
          "interestCumulative": 51944.45,
          "negotiableValue": 10051944.45,
          "dayNumber": 17,